Card Concept,Card Element/Type/Slot,Name,Supertype,Type,Subtype,Element,Cost,Dedication,Text,Strength,Defense,Mana,Territory Defense,Flavor Text,Element ID,Card Number,Rarity,Deckbuilding Points 185,@dedication_image,@rarity_icon,@frame,Card ID,Art ID,@card_image,Set,Subset,@set_symbol,Copyright Text,Landscape Name,Supertype,Type,Subtype,Landscape Text,Landscape Flavor Text,@Landscape_Dedication,Landscape Mana,Landscape Defense,@rarity_icon_landscape,@image_landscape,Landscape Copyright Text,Ben's Rating,Dan's Rating
"skeleton with recursion7/3/17: Changed so they have to be defeated twice in battle to ""die"".",Common Shadow Unit,Shambling Skeleton,,Unit,Skeleton Minion,Shadow,1,1,"Whenever Shambling Skeleton is defeated in battle, deplete it instead of putting it into its owner's discard. If Shambling Skeleton is already depleted, banish it instead of depleting it or putting it into its owner's discard. ^(If a charging unit defeats Shambling Skeleton, it moves into the space it is charging into.)^",1,2,,,"ßß^""Do the dead rise?""ß— Ghis expression for ""Do you think I’m joking?""^",S,175,Common,0,dedication_Shadow_1.png,Common.png,frame_Unit_Shadow.psd,S175,4,004-Prime-Shadow.png,Prime,_,Prime.png,"© & ™ 2017 Arcane Arts, LLC. All Rights Reserved. Prime _ _ - S175",,,,,,,,,,,,,0,0
Aggressive 4/4,Common Shadow Unit,Moonblade Agent,,Unit,Vampire Rogue,Shadow,2,2,,2,1,,,"ßß^""The Moonblade Guild is full of criminals and low-life thieves, but the commoners fear them, and they're visible enough to provide cover for actual assassins.""ß— Lady Kythrin, Councillor of Merenthia^",S,176,Common,0,dedication_Shadow_2.png,Common.png,frame_Unit_Shadow.psd,S176,30,030-Prime-Shadow.png,Prime,_,Prime.png,"© & ™ 2017 Arcane Arts, LLC. All Rights Reserved. Prime _ _ - S176",,,,,,,,,,,,,0,0
Uncommon unit with a discard ability,Common Shadow Unit,Undercity Mortician,,Unit,Human Cleric,Shadow,3,1,"^Strategy Phase Only^ — Pay {1}, £, banish a unit card in a discard: Draw a card from the bottom of your deck.",1,1,,,"ßß^They decide which secrets stay buried forever, and which may resurface. ^",S,177,Common,0,dedication_Shadow_1.png,Common.png,frame_Unit_Shadow.psd,S177,death,prime-death-Shadow.jpg,Prime,_,Prime.png,"© & ™ 2017 Arcane Arts, LLC. All Rights Reserved. Prime _ _ - S177",,,,,,,,,,,,,0,0
French vanilla small (Backstab - double attack rolls if the unit is behind this unit),Common Shadow Unit,Ghis Cutthroat ,,Unit,Human Rogue,Shadow,3,1,"%Backstab% {2} ^(When you summon this unit, you may pay its Backstab cost to attack target enemy unit in the same space. If you do, double its Strength until the end of the battle.)^",3,2,,,ßß^Looters and lost travelers all reach a sudden end in the abandoned streets of Ghis.^,S,178,Common,0,dedication_Shadow_1.png,Common.png,frame_Unit_Shadow.psd,S178,14,014-Prime-Shadow.png,Prime,_,Prime.png,"© & ™ 2017 Arcane Arts, LLC. All Rights Reserved. Prime _ _ - S178",,,,,,,,,,,,,0,0
Steals defense when cast.,Common Shadow Unit,Essence Drinker,,Unit,Vampire,Shadow,5,2,"%Flying% ^(This unit may march into and out of spaces occupied by enemy units.)^ßßPay {4}, £: Enemy units adjacent to Essence Drinker get %Defense -1% until the end of the turn.",2,4,,,,S,179,Common,0,dedication_Shadow_2.png,Common.png,frame_Unit_Shadow.psd,S179,caster,prime-caster-Shadow.jpg,Prime,_,Prime.png,"© & ™ 2017 Arcane Arts, LLC. All Rights Reserved. Prime _ _ - S179",,,,,,,,,,,,,0,0
Large vanilla,Common Shadow Unit,Gravebound Wraith,,Unit,Ghost,Shadow,8,1,,7,5,,,^Even the dead have leaders who can be pressed into service.^,S,180,Common,0,dedication_Shadow_1.png,Common.png,frame_Unit_Shadow.psd,S180,creepy,prime-creepy-Shadow.jpg,Prime,_,Prime.png,"© & ™ 2017 Arcane Arts, LLC. All Rights Reserved. Prime _ _ - S180",,,,,,,,,,,,,0,0
"When it comes into play, reduce adjacent enemy unit defense to 1.7/3/17: I'm concerned about how much removal Shadow has, so changing this to a really stealthy unit.",Uncommon Shadow Unit,Creeping Shade,,Unit,Shade,Shadow,1,1,"%Flying%ßßCreeping Shade can't be attacked if its Defense is 0.ßßPay {3}: Put a +1/+1 counter on Creeping Shade.ßßAt the beginning of your turn, remove all +1/+1 counters from Creeping Shade.",0,0,,,,S,181,Uncommon,1,dedication_Shadow_1.png,Uncommon.png,frame_Unit_Shadow.psd,S181,wraith,prime-wraith-Shadow.jpg,Prime,_,Prime.png,"© & ™ 2017 Arcane Arts, LLC. All Rights Reserved. Prime _ _ - S181",,,,,,,,,,,,,0,0
"May be played in enemy territory if adjacent to a ruins or one of itself.7/3/17: Changed to Graverobber (draws a card when it comes into play)",Uncommon Shadow Territory,Moonblade Delver,,Unit,,Shadow,2,1,"When you summon Moonblade Delver, draw a card from the bottom of your deck.",2,1,,,,S,182,Uncommon,1,dedication_Shadow_1.png,Uncommon.png,frame_Unit_Shadow.psd,S182,warrior2,prime-warrior2-Shadow.jpg,Prime,_,Prime.png,"© & ™ 2017 Arcane Arts, LLC. All Rights Reserved. Prime _ _ - S182",,,,,,,,,,,ruins_shadow.jpg,,0,0
Trinket thief - gain control of target relic,Uncommon Shadow Unit,Trinket Thief,,Unit,Human Rogue,Shadow,3,1,"Pay {X}, sacrifice Trinket Thief: Gain control of target relic or strategy with mana cost X.",2,1,,,"ßß^""I trust a Merenthian as far as I can throw him. Let's just say I can be pretty trusting.""ß— Bhu, Ogre General^",S,183,Uncommon,1,dedication_Shadow_1.png,Uncommon.png,frame_Unit_Shadow.psd,S183,merchant,prime-merchant-Shadow.jpg,Prime,_,Prime.png,"© & ™ 2017 Arcane Arts, LLC. All Rights Reserved. Prime _ _ - S183",,,,,,,,,,,,,4,4
"medium sized rogue with backstab and overkill (if it kills one unit, it may attack a second)",Uncommon Shadow Unit,Merenthian Scoundrel,,Unit,Human Rogue,Shadow,3,1,"%Backstab% {3} ^(When you summon this unit, you may pay its Backstab cost to attack target enemy unit in the same space. If you do, double its Strength until the end of the battle.)^ßßWhen you pay Merenthian Scoundrel's Backstab cost, draw a card.",3,3,,,,S,184,Uncommon,1,dedication_Shadow_1.png,Uncommon.png,frame_Unit_Shadow.psd,S184,17,017-Prime-Shadow.png,Prime,_,Prime.png,"© & ™ 2017 Arcane Arts, LLC. All Rights Reserved. Prime _ _ - S184",,,,,,,,,,,,,0,0
"sacrifice to cause player to discard.7/3/17: Simplified, now has discard death trigger",Uncommon Shadow Unit,Mindreaper,,Unit,Ghost Reaper,Shadow,4,2,"%Flying% ^(This unit may march into and out of spaces occupied by enemy units.)^ßßWhen Mindreaper is defeated in a battle, target player discards 2 cards.",2,3,,,,S,185,Uncommon,1,dedication_Shadow_2.png,Uncommon.png,frame_Unit_Shadow.psd,S185,demon,prime-demon-Shadow.jpg,Prime,_,Prime.png,"© & ™ 2017 Arcane Arts, LLC. All Rights Reserved. Prime _ _ - S185",,,,,,,,,,,,,0,0
"Skeletal Mage - 2/3 Ranged, can't attack territories ranged.",Uncommon Shadow Unit,Spectral Sorcerer,,Unit,Ghost Mage,Shadow,5,2,%Ranged% ^(This unit may attack other units up to one space away without moving.)^ßßSpectral Sorcerer cannot besiege territories with Ranged attacks.,3,2,,,ßß^Their gaunt forms contain but a fragment of their original power.^,S,186,Uncommon,1,dedication_Shadow_2.png,Uncommon.png,frame_Unit_Shadow.psd,S186,37,037-Prime-Shadow.png,Prime,_,Prime.png,"© & ™ 2017 Arcane Arts, LLC. All Rights Reserved. Prime _ _ - S186",,,,,,,,,,,,,0,0
Gets additional attack when attacking players,Rare Shadow Unit,Kythrin's Assassin,,Unit,Human Rogue,Shadow,2,2,"%Backstab% {2} ^(When you summon this unit, you may pay its Backstab cost to attack target enemy unit in the same space. If you do, double its Strength until the end of the battle.)^ßßWhen Kythrin's Assassin besieges a territory, it gains %Strength -2% until the end of the turn.",3,2,,,,S,187,Rare,2,dedication_Shadow_2.png,Rare.png,frame_Unit_Shadow.psd,S187,33,033-Prime-Shadow.png,Prime,_,Prime.png,"© & ™ 2017 Arcane Arts, LLC. All Rights Reserved. Prime _ _ - S187",,,,,,,,,,,,,0,0
"Ancestral Remains - Skeleton. Whenever a unit comes under your control from your discard, put a 1/1 counter on this.",Rare Shadow Unit,Unearthed Abomination,,Unit,Skeleton Minion,Shadow,3,2,"When you summon Unearthed Abomination, target player discards a card.",2,0,,,ßß^The mere sight of its twisted and mangled form is enough to drive anyone to madness.^,S,188,Rare,2,dedication_Shadow_2.png,Rare.png,frame_Unit_Shadow.psd,S188,38,038-Prime-Shadow.png,Prime,_,Prime.png,"© & ™ 2017 Arcane Arts, LLC. All Rights Reserved. Prime _ _ - S188",,,,,,,,,,,,,0,0
Gets a counter every time something dies. Counters add attack and defense.,Rare Shadow Unit,Death Warden,,Unit,Ghost Reaper,Shadow,4,1,"Whenever a unit dies, you may pay {1}. If you do, put a +1/+1 counter on Death Warden.",1,1,,,"ßß^As they pass into the next world, she is there to greet them.^",S,189,Rare,2,dedication_Shadow_1.png,Rare.png,frame_Unit_Shadow.psd,S189,snake,prime-snake-Shadow.jpg,Prime,_,Prime.png,"© & ™ 2017 Arcane Arts, LLC. All Rights Reserved. Prime _ _ - S189",,,,,,,,,,,,,0,0
Necromancer and skeleton lord,Rare Shadow Unit,"Ranith, Son of Ix",Legendary,Unit,Human Necromancer,Shadow,4,2,"When you summon Ranith, Son of Ix, you may return target Skeleton from your discard to your hand.ßßSkeletons you control get %Strength +1% and cost {1} less to summon from your hand.",2,4,,,,S,190,Rare,2,dedication_Shadow_2.png,Rare.png,frame_Unit_Shadow.psd,S190,moon3,prime-moon3-Shadow.jpg,Prime,_,Prime.png,"© & ™ 2017 Arcane Arts, LLC. All Rights Reserved. Prime _ _ - S190",,,,,,,,,,,,,0,0
"Must be cast in cavalry, has flying and 2 Movement. Gets Strength +2 if on opponent's side.",Rare Shadow Unit,Unchained Demon,,Unit,Demon,Shadow,6,2,"%Flying% ^(This unit may march into and out of spaces occupied by enemy units.)^ßßWhen you summon Unchained Demon, you may sacrifice any number of units. If you do, put twice that many +1/+1 counters on Unchained Demon.",5,4,,,"ßß^Bound no longer to the void, it darkens the sky with its ominous presence.^",S,191,Rare,2,dedication_Shadow_2.png,Rare.png,frame_Unit_Shadow.psd,S191,53,053-Prime-Shadow.png,Prime,_,Prime.png,"© & ™ 2017 Arcane Arts, LLC. All Rights Reserved. Prime _ _ - S191",,,,,,,,,,,,,0,0
Return a unit from your discard to your hand.,Common Shadow Spell,Undeath,Strategic,Spell,Necromancy,Shadow,1,1,Return target unit from your discard to your hand.,,,,,"ßß^""Despite what many think, these were once our brothers-in-arms. It is our duty to provide them the rest they deserve.""ß— Gareth Thenn^",S,192,Common,0,dedication_Shadow_1.png,Common.png,frame_Spell_Shadow.psd,S192,death2,prime-death2-Shadow.jpg,Prime,_,Prime.png,"© & ™ 2017 Arcane Arts, LLC. All Rights Reserved. Prime _ _ - S192",,,,,,,,,,,,,0,0
Target player discards a card.,Common Shadow Tactic,Instill Fear,Tactical,Spell,Enchantment,Shadow,2,1,Reduce target defending unit's next defense roll by 10. This cannot reduce the defense roll to less than 1.,,,,,"ßß^""With discipline, we control our forces. With fear, we control our theirs.""ß— Aranon, the Conqueror^",S,193,Common,0,dedication_Shadow_1.png,Common.png,frame_tactical_Spell_Shadow.psd,S193,22,022-Prime-Shadow.png,Prime,_,Prime.png,"© & ™ 2017 Arcane Arts, LLC. All Rights Reserved. Prime _ _ - S193",,,,,,,,,,,,,0,0
Double target unit's attack roll.,Common Shadow Tactic,Tainted Well,Strategic,Spell,Alteration,Shadow,2,1,Reduce target enemy unit's Defense by 4 until the end of the turn. This cannot reduce that unit's Defense to less than 1.,,,,,"ßß^""The corruption spreads beneath even the roots of this place."" ß— Geena, the Forestcaller^",S,194,Common,0,dedication_Shadow_1.png,Common.png,frame_Spell_Shadow.psd,S194,29,029-Prime-Shadow.png,Prime,_,Prime.png,"© & ™ 2017 Arcane Arts, LLC. All Rights Reserved. Prime _ _ - S194",,,,,,,,,,,,,0,0
Destroy target non-shadow unit.,Common Shadow Spell,Casualty of War,Tactical,Spell,Destruction,Shadow,3,2,Kill target unit. Cast this spell only if there is a conquered territory on the battlefield.,,,,,"ßß^""I tried to prevent this war, yet I find myself no more able to cease this conflict than I can return this ink to its bottle.""ß— Journal Entry, Ranith, Son of Ix^",S,195,Common,0,dedication_Shadow_2.png,Common.png,frame_tactical_Spell_Shadow.psd,S195,execution2,prime-execution2-Shadow.jpg,Prime,_,Prime.png,"© & ™ 2017 Arcane Arts, LLC. All Rights Reserved. Prime _ _ - S195",,,,,,,,,,,,,0,0
"Relic that causes an opponent to discard a card if you control the unit with the highest strength7/3/17: Changed to Stalker's Oath",Common Shadow Strategy,Stalker's Oath,,Strategy,Plan,Shadow,3,2,"Whenever an opponent summons a unit, if Stalker's Oath is a strategy, it becomes a 5/1 Shadow Rogue unit. Move it into the same space that unit was summoned to.",,,,,,S,196,Common,0,dedication_Shadow_2.png,Common.png,frame_Strategy_Shadow.psd,E196,creepy,prime-creepy-Shadow.jpg,Prime,_,Prime.png,"© & ™ 2017 Arcane Arts, LLC. All Rights Reserved. Prime _ _ - E196",,,,,,,,,,,,,0,0
Possession spell,Common Shadow Spell,Dark Possession,Strategic,Spell,Alteration,Shadow,4,1,Target unit loses all abilities and becomes a 4/4 Shadow unit with %Flying% until the end of the turn ^(it may march into and out of spaces occupied by enemy units)^.,,,,,,S,197,Common,0,dedication_Shadow_1.png,Common.png,frame_Spell_Shadow.psd,S197,moon,prime-moon-Shadow.jpg,Prime,_,Prime.png,"© & ™ 2017 Arcane Arts, LLC. All Rights Reserved. Prime _ _ - S197",,,,,,,,,,,,,,
Return a unit from the discard to a Ruins you control.,Uncommon Shadow Spell,Eternal Servitude,Strategic,Spell,Necromancy,Shadow,X,1,Summon target Shadow unit with mana cost X or less in any discard to an unconquered Ruins you control. ^(X may be any amount of mana you choose to pay when you cast this spell.)^,,,,,"ßß^""I have not brought you back to life, I have brought you back to serve.""ß— Khara, Sister of Ix^",S,198,Uncommon,1,dedication_Shadow_1.png,Uncommon.png,frame_Spell_Shadow.psd,S198,invocation,prime-invocation-Shadow.jpg,Prime,_,Prime.png,"© & ™ 2017 Arcane Arts, LLC. All Rights Reserved. Prime _ _ - S198",,,,,,,,,,,,,0,0
Destroy a unit with mana cost X,Uncommon Shadow Tactic,Assassin's Price,Tactical,Spell,Destruction,Shadow,X+2,2,Kill target unit with mana cost X. ^(X may be any amount of mana you choose to pay when you cast this spell.)^,,,,,"ßß^“Real change does not come at the stroke of a pen, or at the walls of a siege, but at the tip of a knife.”ß— Lady Kythrin, Councillor of Merenthia^",S,199,Uncommon,1,dedication_Shadow_2.png,Uncommon.png,frame_tactical_Spell_Shadow.psd,S199,8,008-Prime-Shadow.png,Prime,_,Prime.png,"© & ™ 2017 Arcane Arts, LLC. All Rights Reserved. Prime _ _ - S199",,,,,,,,,,,,,0,0
Place a ruins where target unit is if there is no land played there yet.,Uncommon Shadow Spell,Ominous Discovery,Tactical,Spell,Conjuration,Shadow,4,1,Put a Ruins card from your hand onto the battlefield in the space target Shadow unit is on. Cast this spell only if there is no territory on that space. ^(This spell may put a territory you control into an opponent's battlefield.)^,,,,,"ßß^""The excavating crew's reports ceased once they'd reached the base of the pyramid. I will investigate and return with my findings.""ß— Elissa, Councillor of Merenthia^",S,200,Uncommon,1,dedication_Shadow_1.png,Uncommon.png,frame_tactical_Spell_Shadow.psd,S200,37,037-Prime-Shadow.png,Prime,_,Prime.png,"© & ™ 2017 Arcane Arts, LLC. All Rights Reserved. Prime _ _ - S200",,,,,,,,,,,,,0,0
discard a unit. Then target player discards two cards and you draw 2 cards.,Uncommon Shadow Spell,Necessary Losses,Tactical,Spell,Divination,Shadow,6,1,"As an additional cost to cast Necessary Losses, discard a unit card.ßßTarget player discards two cards and you draw two cards.",,,,,,S,201,Uncommon,1,dedication_Shadow_1.png,Uncommon.png,frame_tactical_Spell_Shadow.psd,S201,execution,prime-execution-Shadow.jpg,Prime,_,Prime.png,"© & ™ 2017 Arcane Arts, LLC. All Rights Reserved. Prime _ _ - S201",,,,,,,,,,,,,0,0
Deal damage to a unit you control to tutor for a card.,Rare Shadow Spell,Blood Pact,Strategic,Spell,Divination,Shadow,3,2,"Deplete target you control, then Blood Pact deals 15 damage to that unit. If it survives, you may search your deck for a card, draw it, then shuffle your deck.",,,,,,S,202,Rare,2,dedication_Shadow_2.png,Rare.png,frame_Spell_Shadow.psd,S202,5,005-Prime-Shadow.png,Prime,_,Prime.png,"© & ™ 2017 Arcane Arts, LLC. All Rights Reserved. Prime _ _ - S202",,,,,,,,,,,,,0,0
"Temple of Ix7/3/17: Changed to Last Rites",Rare Shadow Strategy,Last Rites,,Strategy,Ritual,Shadow,4,2,"Whenever a unit an opponent controls dies, you may pay {3}. If you do, draw a card.",,,,,,S,203,Rare,2,dedication_Shadow_2.png,Rare.png,frame_Strategy_Shadow.psd,S203,death,prime-death-Shadow.jpg,Prime,_,Prime.png,"© & ™ 2017 Arcane Arts, LLC. All Rights Reserved. Prime _ _ - S203",,,,,,,,,,,ruins_shadow.jpg,,0,0
All units have their defense reduced to 1 until the end of the turn.,Rare Shadow Tactic,Poison Cloud,Strategic,Spell,Conjuration,Shadow,5,2,Reduce the Defense of all units to 1 until the end of the turn.,,,,,ßß^The undercity vents run on a strict schedule. That schedule is set by the highest bidder.^,S,204,Rare,2,dedication_Shadow_2.png,Rare.png,frame_Spell_Shadow.psd,S204,15,015-Prime-Shadow.png,Prime,_,Prime.png,"© & ™ 2017 Arcane Arts, LLC. All Rights Reserved. Prime _ _ - S204",,,,,,,,,,,,,0,0
"Gain control of a territory, break it and then destroy it (Shadow spell)",Rare Shadow Spell,Grasp of Desecration,Strategic,Spell,Destruction,Shadow,5,2,"Gain control of target enemy territory. That territory is a Ruins until the end of the turn. At the end of the turn, sacrifice it. ^(You may summon units to territories you control.)^",,,,,"ßß^""The decay was instant and unfathomable. What was an idyllic township one day was overrun with the walking dead the next. We could do nothing but burn our dead and vow to never speak of it again.""ß— from Confessions of Kiara the Bard^",S,205,Rare,2,dedication_Shadow_2.png,Rare.png,frame_Spell_Shadow.psd,S205,2,002-Prime-Shadow.png,Prime,_,Prime.png,"© & ™ 2017 Arcane Arts, LLC. All Rights Reserved. Prime _ _ - S205",,,,,,,,,,,,,4,4
Ruins,Common Shadow Territory,Ruins,Basic,Territory,Ruins,Shadow,,1,"^Ruins adds {1} to your mana supply when you play it, and at the beginning of each of your turns. It provides 1 affiliation to Shadow.^",,,~1,2,,S,206,Common,0,dedication_Shadow_1.png,Common.png,frame_Territory_Shadow.psd,S206,47,047-Prime-Shadow.png,Prime,_,Prime.png,"© & ™ 2017 Arcane Arts, LLC. All Rights Reserved. Prime _ _ - S206",Ruins,Basic,Territory,Ruins,"^Ruins adds {1} to your mana supply when you play it, and at the beginning of each of your turns. It provides 1 affiliation to Shadow.^",0,dedication_Shadow_1.png,~1,2,Common.png,ruins_shadow.jpg,"© & ™ 2017 Arcane Arts, LLC. All Rights Reserved. Prime _ _ - S206",0,0
Ruins,Common Shadow Territory,Ruins,Basic,Territory,Ruins,Shadow,,1,"^Ruins adds {1} to your mana supply when you play it, and at the beginning of each of your turns. It provides 1 affiliation to Shadow.^",,,~1,2,,S,207,Common,0,dedication_Shadow_1.png,Common.png,frame_Territory_Shadow.psd,S207,crypt-territory,prime-crypt-territory-Shadow.jpg,Prime,_,Prime.png,"© & ™ 2017 Arcane Arts, LLC. All Rights Reserved. Prime _ _ - S207",Ruins,Basic,Territory,Ruins,"^Ruins adds {1} to your mana supply when you play it, and at the beginning of each of your turns. It provides 1 affiliation to Shadow.^",0,dedication_Shadow_1.png,~1,2,Common.png,ruins_shadow.jpg,"© & ™ 2017 Arcane Arts, LLC. All Rights Reserved. Prime _ _ - S207",0,0
Ruins,Common Shadow Territory,Ruins,Basic,Territory,Ruins,Shadow,,1,"^Ruins adds {1} to your mana supply when you play it, and at the beginning of each of your turns. It provides 1 affiliation to Shadow.^",,,~1,2,,S,208,Common,0,dedication_Shadow_1.png,Common.png,frame_Territory_Shadow.psd,S208,ruins,prime-ruins-Shadow.jpg,Prime,_,Prime.png,"© & ™ 2017 Arcane Arts, LLC. All Rights Reserved. Prime _ _ - S208",Ruins,Basic,Territory,Ruins,"^Ruins adds {1} to your mana supply when you play it, and at the beginning of each of your turns. It provides 1 affiliation to Shadow.^",0,dedication_Shadow_1.png,~1,2,Common.png,ruins_shadow.jpg,"© & ™ 2017 Arcane Arts, LLC. All Rights Reserved. Prime _ _ - S208",0,0
Ruins,Common Shadow Territory,Ruins,Basic,Territory,Ruins,Shadow,,1,"^Ruins adds {1} to your mana supply when you play it, and at the beginning of each of your turns. It provides 1 affiliation to Shadow.^",,,~1,2,,S,209,Common,0,dedication_Shadow_1.png,Common.png,frame_Territory_Shadow.psd,S209,ruins2,prime-ruins2-Shadow.jpg,Prime,_,Prime.png,"© & ™ 2017 Arcane Arts, LLC. All Rights Reserved. Prime _ _ - S209",Ruins,Basic,Territory,Ruins,"^Ruins adds {1} to your mana supply when you play it, and at the beginning of each of your turns. It provides 1 affiliation to Shadow.^",0,dedication_Shadow_1.png,~1,2,Common.png,ruins_shadow.jpg,"© & ™ 2017 Arcane Arts, LLC. All Rights Reserved. Prime _ _ - S209",0,0
Borderland,Common Neutral Territory,Borderland,Basic,Territory,,Neutral,,,"Borderland has the elemental affiliation of all territories adjacent to it. ^(For instance, if Borderland is adjacent to a Wilderness and a Desert, it has 1 affiliation to Earth and 1 affiliation to Air.)^",,,~1,2,,N,210,Common,0,dedication_Neutral_.png,Common.png,frame_Territory_Neutral_Basic.psd,E210,wilderness2,prime-wilderness2-Neutral.jpg,Prime,_,Prime.png,"© & ™ 2017 Arcane Arts, LLC. All Rights Reserved. Prime _ _ - E210",Borderland,Basic,Territory,0,"Borderland has the elemental affiliation of all territories adjacent to it. ^(For instance, if Borderland is adjacent to a Wilderness and a Desert, it has 1 affiliation to Earth and 1 affiliation to Air.)^",0,dedication_Neutral_.png,~1,2,Common.png,wasteland_neutral.jpg,"© & ™ 2017 Arcane Arts, LLC. All Rights Reserved. Prime _ _ - E210",0,0
Search deck for a territory,Common Territory,Terra Nova,,Territory,,Neutral,,,"Pay {1}, sacrifice Terra Nova: Search your deck for a basic territory card, reveal it and draw it, then shuffle your deck.",,,~0,2,,N,211,Common,0,dedication_Neutral_.png,Common.png,frame_Territory_Neutral.psd,E211,49,049-Prime-Neutral.png,Prime,_,Prime.png,"© & ™ 2017 Arcane Arts, LLC. All Rights Reserved. Prime _ _ - E211",Terra Nova,0,Territory,0,"Pay {1}, sacrifice Terra Nova: Search your deck for a basic territory card, reveal it and draw it, then shuffle your deck.",0,dedication_Neutral_.png,~0,2,Common.png,wasteland_neutral.jpg,"© & ™ 2017 Arcane Arts, LLC. All Rights Reserved. Prime _ _ - E211",0,0
Seeking Orb,Common Relic,Orb of Delving,,Relic,,Neutral,2,,"£: Reveal the top four cards of your deck. If any territories are revealed, target opponent chooses one among them. Put any cards not chosen on the bottom of your deck in any order. If your opponent chose a card, draw that card, then sacrifice Orb of Delving.",,,,,ßß^A hundred futures discarded in a desperate bid for power...^,N,212,Common,0,dedication_Neutral_.png,Common.png,frame_Relic_Neutral.psd,E212,40,040-Prime-Neutral.png,Prime,_,Prime.png,"© & ™ 2017 Arcane Arts, LLC. All Rights Reserved. Prime _ _ - E212",,,,,,,,,,,,,,
"Rusted Golem73/17: Moved to Common",Common Relic Unit,Rusted Golem,,Relic Unit,Golem,Neutral,5,1,"Deplete Rusted Golem at the end of any battle where Rusted Golem was the attacking or defending unit. ^(If Rusted Golem wins a charge, it moves prior to depleting.)^",6,6,,,"ßß^“I’ll get the damn thing up and running as best I can, but this hunk of bolts hasn’t seen any action since there was a Khai in Thanguul.”ß— Aidan, Karthan Supply Master^",N,213,Common,0,dedication_Neutral_1.png,Common.png,frame_Relic Unit_Neutral.psd,E213,20,020-Prime-Neutral.png,Prime,_,Prime.png,"© & ™ 2017 Arcane Arts, LLC. All Rights Reserved. Prime _ _ - E213",,,,,,,,,,,,,0,0
Stronghold gives + defense,Uncommon Neutral Territory,Stronghold,,Territory,,Neutral,,,Pay {3}: Stronghold gains %Defense +1% until the end of the turn.,,,~1,1,,N,214,Uncommon,1,dedication_Neutral_.png,Uncommon.png,frame_Territory_Neutral.psd,E214,49,049-Prime-Neutral.png,Prime,_,Prime.png,"© & ™ 2017 Arcane Arts, LLC. All Rights Reserved. Prime _ _ - E214",Stronghold,0,Territory,0,Pay {3}: Stronghold gains %Defense +1% until the end of the turn.,0,dedication_Neutral_.png,~1,1,Uncommon.png,wasteland_neutral.jpg,"© & ™ 2017 Arcane Arts, LLC. All Rights Reserved. Prime _ _ - E214",0,0
Relic that makes each player draw additional cards each turn,Uncommon Neutral Relic,Selphirian Tome,,Relic,,Neutral,6,,"Pay {4}, £: Draw a card.",,,,,"ßß^When Selphiria drowned, not all of its secrets did...^",N,215,Uncommon,1,dedication_Neutral_.png,Uncommon.png,frame_Relic_Neutral.psd,E215,tome,prime-tome-Neutral.jpg,Prime,_,Prime.png,"© & ™ 2017 Arcane Arts, LLC. All Rights Reserved. Prime _ _ - E215",,,,,,,,,,,,,0,0
"Relic that you can pay mana to to draw a card7/4/17: Changed to Battering Ram from Token of Power",Uncommon Neutral Relic,Battering Ram,,Relic,,Neutral,3,,Units you control get %Strength +1% until the end of the battle whenever they besiege a territory.,,,,,,N,216,Uncommon,1,dedication_Neutral_.png,Uncommon.png,frame_Relic_Neutral.psd,E216,batteringram,prime-batteringram-Neutral.jpg,Prime,_,Prime.png,"© & ™ 2017 Arcane Arts, LLC. All Rights Reserved. Prime _ _ - E216",,,,,,,,,,,,,0,0
